headline,description,category,source,url
Students Against Discrimination to form committees outside Dhaka too,The Students Against Discrimination wants to work as a pressure group in the reform of the state at the district level. The central coordinators also feel that they need to have an organised team to uphold the spirit of the mass uprising,Politics,prothomalo,https://en.prothomalo.com/bangladesh/politics/9lt6coccbn
Meetings to exchange views: Proposals made to form alternative political platform,"Several demands and proposals, including constituting an alternative political platform, ensuring transparency in the important tasks of the state and protecting the spirit of July-August mass-uprising, were raised in the district level meetings organised by the Students Against Discrimination to exchange views",Politics,prothomalo,https://en.prothomalo.com/bangladesh/politics/9euuzgifey
Interim govt must win BNP's unshakeable trust: Tarique,"BNP acting chairman Tarique Rahman on Saturday said the interim government, led by Dr Muhammad Yunus, must take on the challenge of winning the BNP's trust unshakably.",Politics,prothomalo,https://en.prothomalo.com/bangladesh/politics/zuydjpr55o
DU Shibir denies involvement in cutting tendons,It alleged that the Awami League considered Chhatra Shibir as the strongest threat to establishing fascism in the country.,Politics,prothomalo,https://en.prothomalo.com/bangladesh/politics/sb1t1371ev
Political parties want a timeframe from the govt too,There hasn’t been any statement from the government regarding the possible date of the next parliamentary polls,Politics,prothomalo,https://en.prothomalo.com/bangladesh/politics/il6c8c4cye
"Dhaka University unit Shibir president makes revelation, draws reactions",Some were surprised as they knew him personally but could not learn or understand his political identity. Some expressed concerns over the open politics of Shibir in Dhaka University.,Politics,prothomalo,https://en.prothomalo.com/bangladesh/politics/utx1xglrv3
Indian high commissioner Pranay Verma meets BNP's Mirza Fakhrul,Indian high commissioner Pranay Verma has met BNP secretary general Mirza Fakhrul Islam Alamgir.,Politics,prothomalo,https://en.prothomalo.com/bangladesh/politics/3doy6dpzed
"Govt of mass-uprising surely a govt of people: Tarique ",He made the statement while addressing a commemoration programme at Enayetpur Islamia High School in Sirajganj on Saturday afternoon.,Politics,prothomalo,https://en.prothomalo.com/bangladesh/politics/9l28jxnvve
Youth have the right to form a new political party: Farhad Mazhar,"If the present political parties are unable to fulfill the expectations of the people as expressed through the youth, then there is need for a new political party, feels poet, writer and political commentator Farhad Mazhar. He said, the youth have the right to form a new political party.",Politics,prothomalo,https://en.prothomalo.com/bangladesh/politics/o9telnmxce
Fakhrul senses conspiracy behind unrest in hills,"The remarks made by deposed prime minister Sheikh Hasina while in India are having a significant impact in Bangladesh, he said",Politics,prothomalo,https://en.prothomalo.com/bangladesh/politics/b8db5u1ky6
Student politics banned in 33 institutions of higher education,"In face of student demands, student politics has been banned in at least 19 public universities, 4 government colleges and 10 government medical colleges. Student politics was prohibited in these institutions after the fall of the Awami League government on 5 August following the student-people's mass uprising. ",Politics,prothomalo,https://en.prothomalo.com/bangladesh/politics/9nixoixo56
Interim govt cannot be allowed to fail: Tarique Rahman,"He also urged the interim government to remain cautious so that they do not end up being the reason for their own failure. ",Politics,prothomalo,https://en.prothomalo.com/bangladesh/politics/3j4rh4vvck
Asif Mahmud bins 'rumour' of potential political party by students,He also clarified that no members of the current government have aspirations for power,Politics,prothomalo,https://en.prothomalo.com/bangladesh/politics/yt6wbk4enr
BNP rally begins at Naya Paltan,"Tarique Rahman, the party's acting chairperson, is expected to address the rally virtually",Politics,prothomalo,https://en.prothomalo.com/bangladesh/politics/d2oj5vmaer
We have long way to go to build strong democracy: Tarique,He came up with the statement marking the occasion of the International Day of Democracy on Sunday,Politics,prothomalo,https://en.prothomalo.com/bangladesh/politics/socsmvkasi
