headline,description,category,source,url
Five-star Rabada reduces Bangladesh to 137-8 at lunch,"South Africa fast bowler Kagiso Rabada wreaked havoc on the Bangladesh batting line-up Thursday, reducing them to 48-8 before a mini-fightback to 137-8 at lunch on the third day of the second Test.",Sports,prothomalo,https://en.prothomalo.com/sports/cricket/wbifha60in
De Zorzi out for 177 as S Africa power to 413-5 against Bangladesh,Tony de Zorzi’s commanding innings ended on 177 Wednesday as South Africa powered to 413-5 at lunch against Bangladesh on day two of the second and final Test,Sports,prothomalo,https://en.prothomalo.com/sports/cricket/d3ec0hod8d
"Decision on Shakib’s future, Najmul’s captaincy today","Is Najmul Hossain really giving up the captaincy of the national cricket team for all versions? Is the ongoing Chattogram Test against South Africa going to be his last match as captain? If so, who will be the new captain?",Sports,prothomalo,https://en.prothomalo.com/sports/cricket/wtsydzidsf
"De Zorzi, Stubbs tons steer S Africa to 307/2 against Bangladesh",Both men made their maiden Test hundreds in a second-wicket partnership of 201 after the visitors won the toss and chose to take first use of a good batting pitch as they eye a series sweep.,Sports,prothomalo,https://en.prothomalo.com/sports/cricket/tc6juuzv1m
De Zorzi steers S. Africa to 109-1 at lunch against Bangladesh,Captain Aiden Markram was the only wicket to fall after he went for a big shot off left-arm spinner Taijul Islam and holed out to Mominul Haque at mid-on for 33,Sports,prothomalo,https://en.prothomalo.com/sports/cricket/x4sh96a6qw
"South Africa win toss, bat against Bangladesh","Bangladesh made three changes from the defeat in Mirpur, bringing in Zakir Hasan, Nahid Rana and wicketkeeper Mahidul Islam Ankon for his debut",Sports,prothomalo,https://en.prothomalo.com/sports/cricket/jocw8tdljf
Taijul vows Bangladesh to bounce back against South Africa,"Bangladesh spinner Taijul Islam said Monday he was determined to level the series against South Africa in the second and final Test, after a crushing seven-wicket defeat in the opener.",Sports,prothomalo,https://en.prothomalo.com/sports/cricket/2qae784ki1
Rodri wins men’s Ballon d’Or as Real Madrid boycott,"The decision to award the prize for the world’s best player to the midfielder came as a surprise, with Real Madrid’s Liga and Champions League double winner Vinicius Junior widely seen as the favourite",Sports,prothomalo,https://en.prothomalo.com/sports/football/i1iw10uids
Manchester United sack manager Ten Hag,"Manchester United have sacked manager Erik ten Hag following the club's lacklustre start to the season, the fallen Premier League giants announced Monday.",Sports,prothomalo,https://en.prothomalo.com/sports/football/eobkxfeho4
Bangladesh thrash Bhutan 7-1 in 1st semi-final,"Defending champions Bangladesh thrashed Bhutan by 7-1 goals in the first semi-final of the SAFF Women’s Championship held at Dasharath Rangasala Stadium in Kathmandu, Nepal",Sports,prothomalo,https://en.prothomalo.com/sports/football/h6gr6z71im
Barca shred Madrid in La Liga Clasico,"Teenage winger Lamine Yamal and Raphinha completed the rout, while Madrid superstar Kylian Mbappe had two goals ruled out for offside",Sports,prothomalo,https://en.prothomalo.com/sports/football/s53slvh6k7
Tabith Awal new BFF president,Tabith Awal bagged 123 votes while his lone opponent Mizanur Rahman Chowdhury got five votes.,Sports,prothomalo,https://en.prothomalo.com/sports/football/l3pnzf6q7o
Najmul Hossain unwilling to continue as captain,"In the recent past, Najmul's captaincy has come under scrutiny from several quarters after a prolonged lean patch. ",Sports,prothomalo,https://en.prothomalo.com/sports/cricket/t873svwm75
New Zealand lead by 301 after Santner’s 7-53 in India,"New Zealand, who lead the three-match series 1-0, were 198-5 at stumps in their second knock after skipper Tom Latham hit 86",Sports,prothomalo,https://en.prothomalo.com/sports/cricket/hwbstq4zvu
New Zealand on top after Santner’s 7-53 in India,"New Zealand, who lead the three-match series 1-0, were 85-2 at tea in their second innings after Washington Sundar trapped Devon Conway lbw for 17 and Ravichandran Ashwin got Will Young for 23",Sports,prothomalo,https://en.prothomalo.com/sports/cricket/9km6d221tx
South Africa captain Bavuma to miss second Bangladesh test,Bavuma missed this week’s seven wicket win over Bangladesh in the first test in Dhaka but had travelled with the team looking to continue his rehabilitation and take his place in the side for the second match,Sports,prothomalo,https://en.prothomalo.com/sports/cricket/0ceal9doif
India 107-7 after Santner takes four wickets for New Zealand,Mitchell Santner led a New Zealand spin blitz on a turning Pune pitch to leave India in serious trouble on 107-7 at lunch on day two of the second Test on Friday.,Sports,prothomalo,https://en.prothomalo.com/sports/cricket/zzoyszzq88
South Africa crush Bangladesh by seven wickets,South Africa won the first Test against Bangladesh by seven wickets before lunch on day four Thursday to take a 1-0 lead in the two-match series,Sports,prothomalo,https://en.prothomalo.com/sports/cricket/9v4dl38ay7
South Africa need 106 to win against Bangladesh,"South Africa have been set a 106-run target, having scored 308 in their first innings on Tuesday, in reply to Bangladesh’s 106 all out on the first day",Sports,prothomalo,https://en.prothomalo.com/sports/cricket/lfbhr772xy
"Mehidy, Jaker take Bangladesh into lead over South Africa",The hosts were 267-7 when the covers came on because of rain in Mirpur and early tea was taken with all-rounder Mehidy batting on 77 alongside Nayeem Hasan on 12,Sports,prothomalo,https://en.prothomalo.com/sports/cricket/mjb4xubbbs
Bangladesh battle at 101-3 as South Africa threaten innings defeat,"South Africa were all out for 308 in their first innings of 308, which secured a 202-run lead for the visitors thanks to wicketkeeper Kyle Verreynne's century.",Sports,prothomalo,https://en.prothomalo.com/sports/cricket/9pdk54hyb5
"South Africa all out for 308, lead by 202 against Bangladesh","For Bangladesh, pace bowler Mehidy Hasan Miraz took three of the four wickets to fall on Tuesday and spinner Taijul Islam finished with 5-122",Sports,prothomalo,https://en.prothomalo.com/sports/cricket/uid7137mtz
We’ve to do really well to win the Test: Taijul,"Taijul was the one who gave Bangladesh a glimmer of hope to turn the table after an abysmal batting show which saw the Tigers bowled out for 106, their lowest in the first innings of a Test match on Day 1 on home soil",Sports,prothomalo,https://en.prothomalo.com/sports/cricket/7zt2liw3ig
Rabada fastest to 300th Test wicket on a 16-wicket day,"The visitors took the lead, reaching 140-6 in 41 overs in reply at stumps at Mirpur, with Wiaan Mulder and Kyle Verreynne not out for 17 and 18 respectively",Sports,prothomalo,https://en.prothomalo.com/sports/cricket/1k14yxbck0
Bangladesh seek winning start against South Africa,Tigers’ confidence to make a winning start to the South Africa series stemmed from the lack of experience of the visiting players on Bangladeshi soil,Sports,prothomalo,https://en.prothomalo.com/sports/cricket/olqr83ze2w
"Young, Ravindra guide New Zealand to first win in India for 36 years","Chasing a tricky 107 on a rain-delayed day, New Zealand lost captain Tom Latham without scoring and Devon Conway for 17.",Sports,prothomalo,https://en.prothomalo.com/sports/cricket/ztkoh98w6d
Rampant Messi hits another hat-trick as Miami break MLS points record,"On-fire Lionel Messi scored his second hat-trick of the week and Luis Suarez scored twice as Inter Miami beat the New England Revolution 6-2 to smash MLS's regular season points record. ",Sports,prothomalo,https://en.prothomalo.com/sports/football/yb2bduier9
India fight back after Ravindra ton cements New Zealand lead,The hosts were 231-3 at stumps and still trailed the Black Caps by 125 runs after Glenn Phillips got Virat Kohli caught behind for 70 on the last ball of the day in Bengaluru,Sports,prothomalo,https://en.prothomalo.com/sports/cricket/rcrflpsclk
Hasan Murad replaces Shakib in 1st Test Squad against SA,"Shakib Al Hasan’s aspiration to play farewell Test in front of home crowd was left unfulfilled as the Bangladesh Cricket Board (BCB) called up uncapped left-arm spinner Hasan Murad to replace him in the Bangladesh squad for the first Test against South Africa, beginning on 21 October in Dhaka",Sports,prothomalo,https://en.prothomalo.com/sports/cricket/nmngq8e4ws
"New Zealand 402 all out, lead by 356 runs in India Test",Rachin Ravindra hit 134 as New Zealand were all out for 402 and a lead of 356 against India on day three of the opening Test on Friday.,Sports,prothomalo,https://en.prothomalo.com/sports/cricket/esx3hjrt4f
Pakistan crush England in second Test to set up series decider,Spinner Noman Ali took eight wickets as Pakistan crushed England by 152 runs in the second Test to level the series 1-1 on Friday in Multan. Noman grabbed 8-46 and Sajid Khan took 2-93 as the pair wrapped up England's second innings for 144 after the visitors were set a daunting target of 297.,Sports,prothomalo,https://en.prothomalo.com/sports/cricket/8fg7dswd3r
Shakib Al Hasan not returning home right now,Shakib Al Hasan is not coming to Bangladesh now. That means he would not be in the Bangladesh squad in the first Test against South Africa in Mirpur,Sports,prothomalo,https://en.prothomalo.com/sports/cricket/moitu5flve
New Zealand bundle out India for 46,"New Zealand fast bowler Matt Henry took five wickets, as India was bundled out for 46 on day two of the weather-hit first Test in Bengaluru on Thursday.",Sports,prothomalo,https://en.prothomalo.com/sports/cricket/34oo46pyk1
India collapse to 34-6 after opting to bat against New Zealand,"New Zealand fast bowler William O’Rourke took three wickets, including that of Virat Kohli, as India collapsed to 34-6 at lunch on day two of the weather-hit first Test in Bengaluru on Thursday",Sports,prothomalo,https://en.prothomalo.com/sports/cricket/qub5hltfy1
India opt to bat against New Zealand in rain-hit Test,"India captain Rohit Sharma on Thursday won the toss and elected to bat against New Zealand in the weather-shortened first Test, which lost its opening day to rain in Bengaluru",Sports,prothomalo,https://en.prothomalo.com/sports/cricket/q6ldip0tjr
Shakib included in squad for South Africa Test,"Shakib Al Hasan has been included in the Test team of Bangladesh that will play in Mirpur against South Africa, starting on 21 October.",Sports,prothomalo,https://en.prothomalo.com/sports/cricket/7awlkubfq6
Pakistan tail frustrates England to reach 358-8 at lunch,Carse’s fellow seamer Matthew Potts (2-65) forced an edge off Salman Agha on a sharp rising delivery with Smith taking another regulation catch to leave the hosts on 302-7,Sports,prothomalo,https://en.prothomalo.com/sports/cricket/pkitjpk8m2
Vintage Messi nets hat trick as Argentina hit Bolivia for six,"The 37-year-old provided an emphatic reminder of his enduring quality with three clinical finishes, two assists and some of his trademark creativity throughout the game as Lionel Scaloni’s side dominated",Sports,prothomalo,https://en.prothomalo.com/sports/football/c0gcp5np7x
"Nothing personal behind dismissal of Hathurusingha, claims BCB chief ","Faruque, during his earlier position as the chief selector, developed differences with the coach on various issues",Sports,prothomalo,https://en.prothomalo.com/sports/cricket/ixynu6io2h
"Hathurusingha suspended, Phil Simmons new coach ",He said former West Indies cricketer Phil Simmons will take over as the head coach of the national team till the ICC Champions Trophy,Sports,prothomalo,https://en.prothomalo.com/sports/cricket/jylwt1s73t
BPL 2025: How the squads look like after players’ draft,Seven participating teams of the upcoming Bangladesh Premier League (BPL) season have completed their teams in players draft held in a city hotel today,Sports,prothomalo,https://en.prothomalo.com/sports/cricket/lzenxyy85y
Sports adviser doesn’t see obstructions in Shakib’s leaving the country,"Though the issue has been clarified from different levels of the government, people’s curiosity over the matter does not seem to die down",Sports,prothomalo,https://en.prothomalo.com/sports/cricket/11f9w8nd9z
Samson ton powers India to series sweep after record total,Opener Sanju Samson’s blistering century helped world champions India hammer Bangladesh in the final T20 on Saturday to sweep the series 3-0 after they posted the format’s highest total by a Test-playing nation of 297-6,Sports,prothomalo,https://en.prothomalo.com/sports/cricket/pb6pe5kf7s
"Bangladesh take on India today, aiming for consolation win","The Tigers are set to face India in the third T20I of their three-match series on Saturday in Hyderabad, hoping to avoid a clean sweep after losing the first two matches.",Sports,prothomalo,https://en.prothomalo.com/sports/cricket/cs8wxzivlo
Leach leads England's rout of Pakistan in first Test,"England's bowlers, led by spinner Jack Leach, tore through Pakistan to secure victory in the first Test in Multan on Friday after a record partnership between Harry Brook and Joe Root turned the match on its head.",Sports,prothomalo,https://en.prothomalo.com/sports/cricket/a603oxcs3e
"Argentina held, Brazil leave it late in 2026 World Cup qualifiers",Argentina were held to a 1-1 draw by Venezuela on Lionel Messi's return as Brazil got their 2026 World Cup qualifying campaign back on track with a last-gasp 2-1 victory over Chile on Thursday.,Sports,prothomalo,https://en.prothomalo.com/sports/football/yvown4rm31
Rafael Nadal calls time on epic tennis career,"Rafael Nadal on Thursday announced he will retire after the Davis Cup finals in November, ending a career which brought 22 Grand Slam titles, global respect and inspired epic, iconic rivalries with Roger Federer and Novak Djokovic.",Sports,prothomalo,https://en.prothomalo.com/sports/r502phuhr5
"Record-breaking Root, Brook both pass 200 as England pile up 658-3",Record-breaking Joe Root and Harry Brook smashed career-best double centuries Thursday as relentless England piled up 658-3 against Pakistan by lunch on the fourth day of the opening Test in Multan.,Sports,prothomalo,https://en.prothomalo.com/sports/cricket/j4xo1e1wuj
"Run blitz edges India, S Africa closer to semi-finals",India and South Africa piled up the two highest totals at the Women’s T20 World Cup on Wednesday to stay on track for the semi-finals,Sports,prothomalo,https://en.prothomalo.com/sports/cricket/orvu4xrbrr
Reddy stars as India crush Bangladesh to clinch series,"Reddy’s blitz included four fours and seven sixes and his 108-run fourth-wicket stand with Rinku Singh, who hit 53, powered India to 221-9 at New Delhi’s Feroz Shah Kotla ground",Sports,prothomalo,https://en.prothomalo.com/sports/cricket/krjvql99rr
EC search committee formed with Justice Zubayer Rahman Chowdhury as chairman,"In accordance with the law, this committee will recommend two candidates for each position, including the Chief Election Commissioner and other election commissioners",Politics,prothomalo,https://en.prothomalo.com/bangladesh/politics/s4r04fd32o
Electoral compromise or initiative to avoid unwarranted situation?,"The letters could be issued from the strategic point of maintaining the political alliance with the like-minded parties in the pre-election period, said political analysts",Politics,prothomalo,https://en.prothomalo.com/bangladesh/politics/2tlqjxjgh6
"Don't let your respect be harmed, Fakhrul tells Dr Yunus ","There is no need to be restless. The interim government will hold an election that will satisfy everyone. But they must be given time, he says",Politics,prothomalo,https://en.prothomalo.com/bangladesh/politics/ycal8ijhmn
Chhatra Shibir comes out on JU campus," Leaders of the Chhatra Shibir's JU unit issued a statement on this matter at 11:30 pm on Tuesday.",Politics,prothomalo,https://en.prothomalo.com/bangladesh/politics/cq4wteu8ys
Process underway to take Khaleda Zia abroad for treatment,She will be taken to London by a long-distance specialised air ambulance and later to a multidisciplinary medical center in a third country.,Politics,prothomalo,https://en.prothomalo.com/bangladesh/politics/hveif2hncq
Khaleda Zia to be taken to London for treatment soon,BNP chairperson Khaleda Zia would be taken abroad for treatment soon. She would first be taken to the United Kingdom,Politics,prothomalo,https://en.prothomalo.com/bangladesh/politics/11jb6j2e8p
Sarjis against mass arrest as many ‘post holders’ of BCL joined student movement,He also clarified that this statement is applicable to Dhaka University only. He has no detailed idea about other universities,Politics,prothomalo,https://en.prothomalo.com/bangladesh/politics/ih5ub2372o
Political parties ask whether govt supports students’ demands,Leaders of various political parties raised the question at a discussion on ‘80 Days of the interim government: Tendencies and challenges’ at Dhaka Reporters’ Unity in the capital on Monday,Politics,prothomalo,https://en.prothomalo.com/bangladesh/politics/4xxnvpuq3w
"Why so busy only about president, BNP’s Rizvi asks interim govt","Why are creating one one after another complexity? There are many aides of Sheikh Hasina among you but you are not taking actions against them, the BNP leader stated",Politics,prothomalo,https://en.prothomalo.com/bangladesh/politics/ks8v6e32ji
Conspiracy on to create constitutional crisis: Salahuddin,"Salahuddin Ahmed made the remarks while addressing event at the Bangabandhu International Conference Center (BICC) at the capital’s Agargaon on Sunday. ",Politics,prothomalo,https://en.prothomalo.com/bangladesh/politics/wcakjv0f6k
Consequence would be grimmer if any party acts like fascists now: Jamaat amir,"Bangladesh Jamaat-e-Islami’s amir Shafiqur Rahman said if any party including his own party acts like fascists, it will face a grimmer consequence than that of the fallen fascist party",Politics,prothomalo,https://en.prothomalo.com/bangladesh/politics/2en8y2v2bi
President’s removal: Mirza Fakhrul calls not to take hasty decision,"No hasty decision could be made if the revolution needs to be consolidated to reap the fruit of the mass uprising, Mirza Fakhrul said",Politics,prothomalo,https://en.prothomalo.com/bangladesh/politics/1ijxymbg5p
Student leaders strive for political consensus,"The BNP leaders in that meeting said their party had no sympathy for President Md Shahabuddin. However, they are doubtful over several factors",Politics,prothomalo,https://en.prothomalo.com/bangladesh/politics/uzc0dvnhuz
People won’t wait indefinitely for elections: BNP,The BNP leader said that a plot of depoliticisation initiated during the 1/11 political changeover is still ongoing,Politics,prothomalo,https://en.prothomalo.com/bangladesh/politics/1usi1x14f5
We don’t believe in politics of banning: BNP’s Khairul Kabir,"The party that will get the people’s mandate will go to power in the future. But there will be no such incident where day’s voting would take place at night, he added",Politics,prothomalo,https://en.prothomalo.com/bangladesh/politics/yds1rnkbpp
"Conspiracies on, arrange election soon: BNP","They also demanded that former prime minister Sheikh Hasina, who fled to India, be brought back to the country immediately.",Politics,prothomalo,https://en.prothomalo.com/bangladesh/politics/vrlik5uqzh
"Many fake, chameleon-like coordinators sprung up after 5 Aug: Sarjis",This central coordinator of Students Against Discrimination also said if any student thinks to be a fascist in the future and tries to abuse power will be expelled and legal actions will be taken against them.,Politics,prothomalo,https://en.prothomalo.com/bangladesh/politics/7yir2w5up5
The way AL did politics in past will never come back in future: Nahid,Information and broadcasting adviser Md. Nahid Islam Wednesday said the fascist Awami League has no right to do politics in the democratic structure of Bangladesh,Politics,prothomalo,https://en.prothomalo.com/bangladesh/politics/8drs7k8fdw
BNP doesn’t want any state or constitutional crisis: Salahuddin,"Bangladesh Nationalist Party (BNP) standing committee member Salahuddin Ahmed has said that his party does not want any state, constitutional and political crisis in the country at the moment centering the post of president.",Politics,prothomalo,https://en.prothomalo.com/bangladesh/politics/veltgi1vmx
BNP delegation meets chief adviser Dr. Yunus,BNP leader Nazrul Islam Khan briefed the journalists after the delegation emerged from the meeting around 12:00 pm Wednesday,Politics,prothomalo,https://en.prothomalo.com/bangladesh/politics/hc3yssulc4
"SAD to unveil a framework on politics, other issues soon","Students Against Discrimination would soon unveil a framework on how politics would work in Bangladesh. The platform's framework will also cover issues such as banning Bangladesh Chhatra League, resignation of the president and formulating a new constitution",Politics,prothomalo,https://en.prothomalo.com/bangladesh/politics/g9clzjuimn
"New debate emerges over keeping AL away from politics, election","A statement from the interim government that it will prevent the political programmes of the parties including the ousted Awami League, which participated in the last three elections, has given rise to new discussions. Different political parties including BNP maintain that the problem will arise if any decision is taken about elections or to prevent parties from politics without discussing with the political parties.",Politics,prothomalo,https://en.prothomalo.com/bangladesh/politics/tt562oxrs6
Jatiya Party not invited to join dialogue with chief adviser,"The leaders of the Jatiya Party had been longing for an invitation, but they got no call at the end",Politics,prothomalo,https://en.prothomalo.com/bangladesh/politics/3vzz17icrm
Dr Yunus to hold dialogue with some parties today ,"The parties are Gano Forum, LDP, Jatiyatabadi Sammana Jot, the 12-Party Alliance, Jatiya Mukti Council, Labour Party, and Bangladesh Jatiya Party (BJP).",Politics,prothomalo,https://en.prothomalo.com/bangladesh/politics/6cdsmog2oa
"Obaidul Quader said he won't flee, but even AL leaders don't know where he is","When Obaidul Quader made this statement at an Awami League public meeting held at the historic madrasa grounds in Rajshahi, also present on stage were Awami League president Sheikh Hasina, who was the prime minister at the time.",Politics,prothomalo,https://en.prothomalo.com/bangladesh/politics/7yimukuh4k
"JaPa co-chair declares Hasnat, Sargis persona non grata in Rangpur","Hasnat Abdullah and Sargis Alam cannot come to Rangpur as they called on Facebook not to invite the Jatiya Party in political dialogues, Mostafizar Rahman said",Politics,prothomalo,https://en.prothomalo.com/bangladesh/politics/3ib1x46wye
Tipu was the new 'king' of Taher’s ‘kingdom’ in Lakshmipur,"Lakshmipur, once dubbed as a 'city of terror', is now much quieter. The people who have been silent for so long have started speaking up about Salah Uddin, the former president of district Jubo League",Politics,prothomalo,https://en.prothomalo.com/bangladesh/politics/h6yyn4x89e
AL should face trial under black laws it created: Jamaat amir,Bangladesh Jamaat e Islami amir (chief) Shafiqur Rahman has sought trial of Awami League under the black laws formulated by the party itself during its long stretch in power,Politics,prothomalo,https://en.prothomalo.com/bangladesh/politics/jis7bhnrzm
"The BCL, Jubo League men who opened fire are not being arrested: Rizvi",Rizvi said this while talking to the media after paying his respect by placing wreaths at the grave of the party founder Ziaur Rahman at Sher-e-Bangla Nagar in the capital,Politics,prothomalo,https://en.prothomalo.com/bangladesh/politics/ba8reucqwn
Jamaat chief backs crimes against humanity trial for Sheikh Hasina,Bangladesh's top Islamist politician says he supports the extradition of ousted premier Sheikh Hasina to face trial for crimes against humanity in the same tribunal that convicted his colleagues.,Politics,prothomalo,https://en.prothomalo.com/bangladesh/politics/tqut7rr7w1
BNP faces flak for activists’ activities in 2 months,"Despite taking the tougher actions that include expulsion, release, demotion and cancelling the committee, there has been no stopping in receiving allegations",Politics,prothomalo,https://en.prothomalo.com/bangladesh/politics/15efrsc76s
Uncertainty over Jatiya Party joining dialogue as objections arise,"Lastly, the party joined the 7 January election and became the opposition in the 12th parliament. ",Politics,prothomalo,https://en.prothomalo.com/bangladesh/politics/2zozxykxru
"Jamaat wants roadmaps on reform, election",Jamaat chief Shafiqur Rahman said the law and order situation of the country has been discussed in the meeting. How the people and the government can work together to improve the law and order situation and keep the nation united against all kinds of conspiracies were discussed during the meeting,Politics,prothomalo,https://en.prothomalo.com/bangladesh/politics/d8fry5zgis
Govt says elections number one priority: Mirza Fakhrul,BNP once again sought a roadmap to elections during adialogue with Chief Adviser to the interim government Dr Muhammad Yunus.,Politics,prothomalo,https://en.prothomalo.com/bangladesh/politics/d6z4fsz3pi
BNP will join talks with interim govt Saturday ,"The interim government is set to begin a new round of dialogue with major political parties on Saturday, starting with a meeting with the Bangladesh Nationalist Party (BNP). ",Politics,prothomalo,https://en.prothomalo.com/bangladesh/politics/5ssw1yg996
